{
  "schema_version": "0.1.0",
  "project": {
    "id": "float_keyer_4k",
    "name": "Original 4K default-budget color key and despill admission fixture",
    "created_at": "2026-10-22T18:48:21.386385Z",
    "updated_at": "2026-10-22T18:51:38.607000Z",
    "creator": "ai-ad-editor",
    "source_revision": "local"
  },
  "settings": {
    "timebase": {
      "ticks_per_second": 90000,
      "display_fps": {
        "num": 10,
        "den": 1
      }
    },
    "canvas": {
      "width": 3840,
      "height": 2160,
      "pixel_aspect": {
        "num": 1,
        "den": 1
      },
      "background": "#000000"
    },
    "color": {
      "primaries": "bt709",
      "transfer": "linear",
      "matrix": "bt709",
      "range": "limited"
    },
    "audio": {
      "sample_rate": 48000,
      "channels": 2
    },
    "output": {
      "container": "mkv",
      "video": {
        "codec": "libx264",
        "preset": "ultrafast",
        "crf": 0,
        "pixel_format": "yuv444p10le"
      },
      "audio": {
        "codec": "pcm_f32le"
      }
    },
    "pixel_pipeline": {
      "engine": "float32-native-v1",
      "working_signal": {
        "primaries": "bt709",
        "transfer": "linear"
      },
      "output_signal": {
        "primaries": "bt709",
        "transfer": "linear"
      },
      "window_frames": 1,
      "max_source_cache_bytes": 268435456,
      "range_policy": "clip",
      "sources": {
        "picture": {
          "source_signal": {
            "primaries": "bt709",
            "transfer": "linear"
          },
          "display_geometry": "square-unrotated"
        }
      }
    }
  },
  "assets": [
    {
      "id": "picture",
      "kind": "video",
      "uri": "assets/source.mkv",
      "sha256": "sha256:73d2bbf9fa7cb04a4003db9eebecfa253a31d10cdb7dc8fa041e474792d7cf2d",
      "probe": {
        "duration_seconds": 0.1,
        "duration_tick": 9000,
        "format": "matroska,webm",
        "format_long_name": "Matroska / WebM",
        "streams": [
          {
            "index": 0,
            "codec_name": "ffv1",
            "codec_long_name": "FFmpeg video codec #1",
            "codec_type": "video",
            "codec_tag_string": "[0][0][0][0]",
            "codec_tag": "0x0000",
            "width": 3840,
            "height": 2160,
            "coded_width": 3840,
            "coded_height": 2160,
            "has_b_frames": 0,
            "pix_fmt": "gbrap16le",
            "level": -99,
            "color_range": "pc",
            "color_space": "gbr",
            "field_order": "progressive",
            "r_frame_rate": "10/1",
            "avg_frame_rate": "10/1",
            "time_base": "1/1000",
            "start_pts": 0,
            "start_time": "0.000000",
            "bits_per_raw_sample": "16",
            "extradata_size": 202,
            "disposition": {
              "default": 0,
              "dub": 0,
              "original": 0,
              "comment": 0,
              "lyrics": 0,
              "karaoke": 0,
              "forced": 0,
              "hearing_impaired": 0,
              "visual_impaired": 0,
              "clean_effects": 0,
              "attached_pic": 0,
              "timed_thumbnails": 0,
              "non_diegetic": 0,
              "captions": 0,
              "descriptions": 0,
              "metadata": 0,
              "dependent": 0,
              "still_image": 0,
              "multilayer": 0
            },
            "tags": {
              "ENCODER": "Lavc62.28.100 ffv1",
              "DURATION": "00:00:00.100000000"
            }
          }
        ],
        "video": {
          "codec": "ffv1",
          "width": 3840,
          "height": 2160,
          "pix_fmt": "gbrap16le",
          "fps": "10/1",
          "color_space": "gbr",
          "duration_seconds": 0.0,
          "start_time_seconds": 0.0
        },
        "audio": {
          "codec": null,
          "sample_rate": 0,
          "channels": 0,
          "duration_seconds": 0.0,
          "start_time_seconds": 0.0
        }
      },
      "rights_ref": "picture"
    }
  ],
  "sequences": [
    {
      "id": "seq_main",
      "name": "Main",
      "duration_tick": 9000,
      "tracks": [
        {
          "id": "track_video_1",
          "kind": "video",
          "order": 0,
          "muted": false,
          "locked": false,
          "clips": [
            {
              "id": "source",
              "asset_id": "picture",
              "timeline_start_tick": 0,
              "duration_tick": 9000,
              "source_in_tick": 0,
              "source_out_tick": 9000,
              "effects": [
                {
                  "type": "green_screen",
                  "parameters": {
                    "input_signal": {
                      "primaries": "bt709",
                      "transfer": "linear"
                    },
                    "color": "#00ff00",
                    "similarity": 0.03,
                    "blend": 0.75,
                    "feather": 0.75,
                    "despill": 0.8,
                    "despill_edges": true
                  }
                }
              ]
            }
          ]
        },
        {
          "id": "track_audio_1",
          "kind": "audio",
          "order": 0,
          "muted": false,
          "locked": false,
          "clips": []
        }
      ],
      "markers": []
    }
  ],
  "templates": [],
  "outputs": [],
  "provenance": {
    "cli_version": "0.1.0",
    "engine_version": "ffmpeg-local",
    "model_versions": [],
    "input_hashes": [],
    "change_log": []
  }
}
